{
  "schema_version": "1.0.0",
  "source": {
    "csv_path": "google_docs/database_of_course_curriculum/APTITUDE Complete Map.csv",
    "repo": "Geoffe-Ga/aptitude-course",
    "sha": "59df2a259f042559989086d0ed4b0efd54faca35",
    "sha256": "b9b102370ac9295b3e5a2820b3c35ede6d1413a2216681026e10879f75c0cfec"
  },
  "stages": [
    {
      "aspect": "Agency",
      "category": "Yes-And-Ness",
      "divine_gender_polarity": "Divine Masculine",
      "free_will_description": "When we first move through Beige we operate like a Biological Machine—a bundle of reflexes, needs, cravings, and instincts. Basically, a baby. An addict deep in the territory of abuse. A victim of trauma, deprivation, or circumstance struggling to survive. It’s not something to feel guilty about.",
      "growing_up_stage": "Survival",
      "id": "beige",
      "relationship_to_free_will": "Biological Machine",
      "spiral_dynamics_color": "Beige",
      "stage_number": 1,
      "start_week": 1
    },
    {
      "aspect": "Receptivity",
      "category": "Yes-And-Ness",
      "divine_gender_polarity": "Divine Feminine",
      "free_will_description": "Behavior is steered from the Sacral: toward what feels nice and away from what doesn't, before any argument has been made. Much of what feels nice was installed by inherited stories and by people with an interest in what you reach for, so pleasure is at once real information and an easy leash. Free Will here is not renouncing pleasure or obeying it, but learning to tell the yes that widens you from the yes that narrows you.",
      "growing_up_stage": "Magic",
      "id": "purple",
      "relationship_to_free_will": "Pleasure Seeker",
      "spiral_dynamics_color": "Purple",
      "stage_number": 2,
      "start_week": 4
    },
    {
      "aspect": "Self-Love",
      "category": "Love",
      "divine_gender_polarity": "Divine Masculine",
      "free_will_description": "APTITUDE teaches that Free Will only becomes real when you learn to express power differently. The Dominator believes they are acting freely, but in truth, they are ruled by fear and shame. Their \"choices\" are reactions. Their \"power\" is armor.",
      "growing_up_stage": "Ego-centrism",
      "id": "red",
      "relationship_to_free_will": "Dominator",
      "spiral_dynamics_color": "Red",
      "stage_number": 3,
      "start_week": 7
    },
    {
      "aspect": "Community Love",
      "category": "Love",
      "divine_gender_polarity": "Divine Feminine",
      "free_will_description": "At Blue, you do what you're told. You follow the rules. You meet the expectations.",
      "growing_up_stage": "Conformity",
      "id": "blue",
      "relationship_to_free_will": "Victim",
      "spiral_dynamics_color": "Blue",
      "stage_number": 4,
      "start_week": 10
    },
    {
      "aspect": "Intellectual Understanding",
      "category": "Understanding",
      "divine_gender_polarity": "Divine Masculine",
      "free_will_description": "Behavior is based on chasing things valued by the culture: money, wealth, status, privilege, fame… in short, achievement. Although the question may arise, Free Will is still uninteresting and left largely unconsidered",
      "growing_up_stage": "Achievest",
      "id": "orange",
      "relationship_to_free_will": "Status Seeker",
      "spiral_dynamics_color": "Orange",
      "stage_number": 5,
      "start_week": 13
    },
    {
      "aspect": "Embodied Understanding",
      "category": "Understanding",
      "divine_gender_polarity": "Divine Feminine",
      "free_will_description": "Here's the truth: recognizing that you've been conditioned is not the same as freeing yourself from that conditioning. Naming your trauma is not the same as healing it. Understanding why you're afraid doesn't make you brave.",
      "growing_up_stage": "Pluralistic",
      "id": "green",
      "relationship_to_free_will": "Shadow Glorifier",
      "spiral_dynamics_color": "Green",
      "stage_number": 6,
      "start_week": 16
    },
    {
      "aspect": "Systems Wisdom",
      "category": "Wisdom",
      "divine_gender_polarity": "Divine Masculine",
      "free_will_description": "Yellow is where you start to see the forces. Where you develop enough metacognitive capacity to observe your own patterns as they arise. And from that observation, you gain the smallest sliver of space—the gap between impulse and action. And in that gap, choice becomes possible.",
      "growing_up_stage": "Integrative",
      "id": "yellow",
      "relationship_to_free_will": "Despairing Analyst",
      "spiral_dynamics_color": "Yellow",
      "stage_number": 7,
      "start_week": 19
    },
    {
      "aspect": "True Self Wisdom",
      "category": "Wisdom",
      "divine_gender_polarity": "Divine Feminine",
      "free_will_description": "The part of you that chose to incarnate into these conditions. The part that has a purpose, a mission, a knowing that the personality cannot access through effort alone.",
      "growing_up_stage": "True Self Connection",
      "id": "teal",
      "relationship_to_free_will": "True Self Embodier",
      "spiral_dynamics_color": "Teal",
      "stage_number": 8,
      "start_week": 22
    },
    {
      "aspect": "Unity",
      "category": "Being",
      "divine_gender_polarity": "Divine Hermaphrodite",
      "free_will_description": "The obsession with \"Free\" Will of the previous two stages grows less all consuming and the goal becomes to subsume individual Will into alignment with the Will of Source. Blissful Union of Atman and Brahman.",
      "growing_up_stage": "Effortless Being",
      "id": "ultraviolet",
      "relationship_to_free_will": "Blissy Adept",
      "spiral_dynamics_color": "Ultraviolet",
      "stage_number": 9,
      "start_week": 25
    },
    {
      "aspect": "Emptiness",
      "category": "Awareness",
      "divine_gender_polarity": "Divine Hermaphrodite",
      "free_will_description": "At Clear Light, the question of Free Will dissolves. Not because it's been answered, but because it's been seen through.",
      "growing_up_stage": "Pure Awareness",
      "id": "clearlight",
      "relationship_to_free_will": "Whole Adept",
      "spiral_dynamics_color": "Clear Light",
      "stage_number": 10,
      "start_week": 31
    }
  ],
  "supersessions": [
    {
      "authority": "markdown/04-blue/02-the-mood-of-blue-lovecommunity-love.md",
      "csv_value": "Universal Love",
      "field": "aspect",
      "stage_id": "blue",
      "value": "Community Love"
    },
    {
      "authority": "markdown/01-beige/04-the-relationship-to-free-will-at-beige.md",
      "csv_value": "When Beige is the loudest note, there's no felt question of free will: action is reactive and instinctual, steered by survival needs. This is the Root Chakra, the base of Maslow's pyramid, Piaget's first stage, Erikson's first task—the ground every other capacity stands on, not the bottom of a ranking.",
      "field": "free_will_description",
      "stage_id": "beige",
      "value": "When we first move through Beige we operate like a Biological Machine—a bundle of reflexes, needs, cravings, and instincts. Basically, a baby. An addict deep in the territory of abuse. A victim of trauma, deprivation, or circumstance struggling to survive. It’s not something to feel guilty about."
    },
    {
      "authority": "markdown/03-red/04-the-relationship-to-free-will-at-red-dominator.md",
      "csv_value": "Behavior is driven by a subconscious urge to alleviate the pain of emotions (that may or may not even be consciously noticed) that tell us that we are not enough. Without self-love toward these aversion based feelings, the tendency is to forge dominator \"power over others.\"",
      "field": "free_will_description",
      "stage_id": "red",
      "value": "APTITUDE teaches that Free Will only becomes real when you learn to express power differently. The Dominator believes they are acting freely, but in truth, they are ruled by fear and shame. Their \"choices\" are reactions. Their \"power\" is armor."
    },
    {
      "authority": "markdown/04-blue/04-the-relationship-to-free-will-at-blue-victim.md",
      "csv_value": "Behavior is determined by the attempt to meet the expectations of the relationships that the individual is embedded within; we are defined by roles: partners, parents, children, coworkers, friends, pupils, etc",
      "field": "free_will_description",
      "stage_id": "blue",
      "value": "At Blue, you do what you're told. You follow the rules. You meet the expectations."
    },
    {
      "authority": "markdown/06-green/04-the-relationship-to-free-will-at-green-shadow-glorifier.md",
      "csv_value": "Behavior is driven by a desire to be virtuous, to apply rules fairly, to reduce the influence of hierarchy, and to respect everyone's perspectives. Free Will is still absent as behavior follows predictably from a set of pluralistic heuristics.",
      "field": "free_will_description",
      "stage_id": "green",
      "value": "Here's the truth: recognizing that you've been conditioned is not the same as freeing yourself from that conditioning. Naming your trauma is not the same as healing it. Understanding why you're afraid doesn't make you brave."
    },
    {
      "authority": "markdown/07-yellow/05-the-relationship-to-free-will-at-yellow-intentional-actor.md",
      "csv_value": "The ability to reflect on all the influences of stages prior to Yellow develops and the individual becomes convinced that Free Will is essentially an illusion.",
      "field": "free_will_description",
      "stage_id": "yellow",
      "value": "Yellow is where you start to see the forces. Where you develop enough metacognitive capacity to observe your own patterns as they arise. And from that observation, you gain the smallest sliver of space—the gap between impulse and action. And in that gap, choice becomes possible."
    },
    {